{
  "$schema": "https://json-schema.org/draft/2020-12/schema",
  "$id": "urn:tornadotty:linux-test-policy:qualification-matrix:v1",
  "title": "TornadoTTY Linux qualification matrix",
  "type": "object",
  "additionalProperties": false,
  "required": ["schema_version", "axes", "claims", "execution_graph", "required_capabilities", "cells"],
  "properties": {
    "schema_version": {"const": 1},
    "axes": {
      "type": "object",
      "additionalProperties": false,
      "required": ["display", "optimize", "async_backend", "terminals", "status", "tier"],
      "properties": {
        "display": {
          "const": {
            "none": "No display server is exercised",
            "wayland": "GTK Wayland backend",
            "x11": "GTK X11 backend on native X11, Xvfb, or Xwayland as identified by the cell harness",
            "both": "Separate Wayland and X11 evidence is required or aggregated"
          }
        },
        "optimize": {"const": ["n/a", "ReleaseSafe", "Debug", "both"]},
        "async_backend": {"const": ["n/a", "default", "epoll", "io_uring", "all"]},
        "terminals": {"const": ["n/a", "single", "multi", "all"]},
        "status": {"const": ["PASS", "FAIL", "BLOCKED", "XFAIL", "NOT_IMPLEMENTED"]},
        "tier": {"const": ["local", "release", "full"]}
      }
    },
    "claims": {
      "type": "object",
      "additionalProperties": false,
      "required": [
        "implemented_local_suite_passed",
        "product_boundary_qualification_passed",
        "qualification_host_retired",
        "release_qualification_passed",
        "full_linux_qualification_passed"
      ],
      "properties": {
        "implemented_local_suite_passed": {"type": "boolean"},
        "product_boundary_qualification_passed": {"type": "boolean"},
        "qualification_host_retired": {"type": "boolean"},
        "release_qualification_passed": {"type": "boolean"},
        "full_linux_qualification_passed": {"type": "boolean"}
      }
    },
    "execution_graph": {
      "type": "object",
      "additionalProperties": false,
      "required": ["root_prerequisite", "profile_prerequisites", "resources"],
      "properties": {
        "root_prerequisite": {"$ref": "#/$defs/cell_id"},
        "profile_prerequisites": {
          "type": "object",
          "additionalProperties": false,
          "required": ["Debug", "ReleaseSafe"],
          "properties": {
            "Debug": {"$ref": "#/$defs/cell_id"},
            "ReleaseSafe": {"$ref": "#/$defs/cell_id"}
          }
        },
        "resources": {
          "type": "array",
          "minItems": 1,
          "uniqueItems": true,
          "items": {"$ref": "#/$defs/resource_id"}
        }
      }
    },
    "required_capabilities": {
      "type": "array",
      "minItems": 1,
      "uniqueItems": true,
      "items": {"type": "string", "pattern": "^[a-z][a-z0-9_]*$"}
    },
    "cells": {
      "type": "array",
      "minItems": 1,
      "items": {"$ref": "#/$defs/cell"}
    }
  },
  "$defs": {
    "cell_id": {"type": "string", "pattern": "^[a-z0-9][a-z0-9-]*$"},
    "resource_id": {"type": "string", "pattern": "^[a-z][a-z0-9-]*$"},
    "cell": {
      "type": "object",
      "additionalProperties": false,
      "allOf": [
        {
          "if": {
            "properties": {
              "status": {"enum": ["PASS", "XFAIL"]}
            },
            "required": ["status"]
          },
          "then": {"required": ["environment_profile"]},
          "else": {"not": {"required": ["environment_profile"]}}
        }
      ],
      "required": ["id", "order", "capability", "display", "optimize", "async_backend", "terminals", "status", "tier"],
      "properties": {
        "id": {"$ref": "#/$defs/cell_id"},
        "order": {"type": "integer", "minimum": 0},
        "schedule_priority": {"type": "integer", "minimum": 0},
        "capability": {"type": "string", "pattern": "^[a-z][a-z0-9_]*$"},
        "display": {"enum": ["none", "wayland", "x11", "both"]},
        "optimize": {"enum": ["n/a", "ReleaseSafe", "Debug", "both"]},
        "async_backend": {"enum": ["n/a", "default", "epoll", "io_uring", "all"]},
        "terminals": {"enum": ["n/a", "single", "multi", "all"]},
        "status": {"enum": ["PASS", "FAIL", "BLOCKED", "XFAIL", "NOT_IMPLEMENTED"]},
        "tier": {"enum": ["local", "release", "full"]},
        "environment_profile": {
          "enum": [
            "isolated-none-v1",
            "nested-x11-v1",
            "nested-wayland-v1",
            "nested-wayland-input-v1",
            "nested-wayland-multiwindow-v1",
            "nested-wayland-activation-v1",
            "nested-wayland-scaling-v1",
            "nested-xwayland-scaling-v1",
            "phase-managed-x11-v1",
            "phase-managed-wayland-v1"
          ]
        },
        "depends_on": {
          "type": "array",
          "uniqueItems": true,
          "items": {"$ref": "#/$defs/cell_id"}
        },
        "resources": {
          "type": "array",
          "uniqueItems": true,
          "items": {"$ref": "#/$defs/resource_id"}
        },
        "always_run": {"type": "boolean"},
        "skip_profile_prerequisite": {"type": "boolean"},
        "blocks_display": {"type": "boolean"},
        "command": {"type": "string", "minLength": 1},
        "defect": {"type": "string", "minLength": 1, "pattern": "\\S"},
        "prerequisite": {"type": "string", "minLength": 1, "pattern": "\\S"},
        "tracking": {"type": "string", "minLength": 1, "pattern": "\\S"},
        "expected_exit_code": {
          "type": "integer",
          "minimum": 1,
          "maximum": 255,
          "not": {"const": 77}
        },
        "expected_valgrind_scenario": {"type": "string", "minLength": 1},
        "valgrind_report": {"type": "string", "minLength": 1},
        "suppression_review_governance": {"type": "boolean"}
      }
    }
  }
}
