{
  "schema_version": 1,
  "axes": {
    "display": {
      "none": "No display server is exercised",
      "wayland": "GTK Wayland backend",
      "x11": "GTK X11 backend on native X11, Xvfb, or Xwayland as identified by the cell harness",
      "both": "Separate Wayland and X11 evidence is required or aggregated"
    },
    "optimize": ["n/a", "ReleaseSafe", "Debug", "both"],
    "async_backend": ["n/a", "default", "epoll", "io_uring", "all"],
    "terminals": ["n/a", "single", "multi", "all"],
    "status": ["PASS", "FAIL", "BLOCKED", "XFAIL", "NOT_IMPLEMENTED"],
    "tier": ["local", "release", "full"]
  },
  "claims": {
    "implemented_local_suite_passed": false,
    "product_boundary_qualification_passed": false,
    "qualification_host_retired": true,
    "release_qualification_passed": false,
    "full_linux_qualification_passed": false
  },
  "execution_graph": {
    "root_prerequisite": "prepare-ghostty",
    "profile_prerequisites": {
      "ReleaseSafe": "build-release",
      "Debug": "build-debug"
    },
    "resources": ["abi-mismatch-fixture", "compiler-load", "consolidated-session-journey", "development-server-visual", "fcitx5-gtk-source", "ghostty-source", "system-sleep-inhibitor"]
  },
  "required_capabilities": [
    "build", "terminal_behavior", "api_misuse", "lifecycle", "physical_key_translation",
    "ime_composition", "external_resize", "compositor_scaling", "valgrind", "suppression_governance",
    "staged_packaging", "install_uninstall", "installed_product", "package_qualification", "product_boundary",
    "architecture_contract", "workspace_schema", "workspace_persistence", "workspace_restore",
    "product_worklanes", "product_pane_terminal_lifecycle", "recovery", "platform_xdg_paths", "platform_open",
    "platform_notifications", "platform_clipboard", "platform_settings", "platform_process_launch",
    "ghostty_api_audit", "ghostty_runtime_initialization_order", "ghostty_abi_versioning", "ghostty_async_backend_abi_representation", "rust_ghostty_product_usage", "rust_global_find_product_usage",
    "rust_ghostty_callback_lifecycle", "rust_ghostty_config", "ghostty_abi_compatibility",
    "agent_integration", "attention_inbox", "agent_fleet", "agent_sleep_inhibition", "remote_transfer", "product_feature_regression", "about_licenses", "development_servers", "task_runners", "task_manager", "task_manager_network_accounting", "task_manager_isolation", "git_review_context", "project_icons", "open_with", "bookmarks_presets_save_restore", "bookmarks_presets_management", "bookmarks_presets_import_export", "shortcut_binding_runtime", "shell_integration", "cli_source_compatibility", "product_cli_options"
  ],
  "cells": [
    {"id":"agent-pty-overload-x11","order":70,"capability":"agent_integration","display":"x11","optimize":"ReleaseSafe","async_backend":"default","terminals":"multi","status":"PASS","tier":"release","environment_profile":"nested-x11-v1","command":"ZENTTY_LINUX_BINARY=build/linux-profiles/release-safe/bin/zentty-linux ZENTTY_AGENT_IPC_SCENARIO=overload GDK_BACKEND=x11 linux/tests/rust-agent-ipc"},
    {"id":"prepare-ghostty","order":9,"capability":"build","display":"none","optimize":"n/a","async_backend":"n/a","terminals":"n/a","status":"PASS","tier":"local","resources":["ghostty-source"],"environment_profile":"isolated-none-v1","command":"linux/scripts/prepare-ghostty-source"},
    {"id":"build-release","order":10,"capability":"build","display":"none","optimize":"ReleaseSafe","async_backend":"n/a","terminals":"n/a","status":"PASS","tier":"local","depends_on":["prepare-ghostty"],"environment_profile":"isolated-none-v1","command":"ZENTTY_ZIG_LOCAL_CACHE_DIR=build/linux-deps/ghostty/.zig-cache/qualification/release-safe ZENTTY_GHOSTTY_PREPARED=true ZENTTY_GHOSTTY_INSTALL_DIR=build/linux-deps/ghostty-install/release-safe linux/scripts/build-local && linux/tests/binary-hardening && linux/tests/abi-surface"},
    {"id":"product-cli-options","order":11,"capability":"product_cli_options","display":"none","optimize":"ReleaseSafe","async_backend":"n/a","terminals":"n/a","status":"PASS","tier":"local","depends_on":["build-release"],"environment_profile":"isolated-none-v1","command":"ZENTTY_LINUX_BINARY=build/linux-profiles/release-safe/bin/zentty-linux linux/tests/rust-product-cli-options"},
    {"id":"prepare-package-source","order":11,"schedule_priority":0,"capability":"package_qualification","display":"none","optimize":"n/a","async_backend":"n/a","terminals":"n/a","status":"PASS","tier":"release","environment_profile":"isolated-none-v1","command":"linux/tests/debian-package-source-fixture"},
    {"id":"visual-parity-map","order":11,"capability":"architecture_contract","display":"none","optimize":"n/a","async_backend":"n/a","terminals":"multi","status":"PASS","tier":"local","environment_profile":"isolated-none-v1","command":"linux/tests/visual-parity"},

    {"id":"release-wayland-default-single","order":20,"capability":"terminal_behavior","display":"wayland","optimize":"ReleaseSafe","async_backend":"default","terminals":"single","status":"PASS","tier":"local","environment_profile":"nested-wayland-v1","command":"GDK_BACKEND=wayland ZENTTY_LINUX_ASYNC_BACKEND=default linux/tests/rust-product-smoke"},
    {"id":"release-wayland-default-multi","order":20,"capability":"terminal_behavior","display":"wayland","optimize":"ReleaseSafe","async_backend":"default","terminals":"multi","status":"PASS","tier":"local","environment_profile":"nested-wayland-v1","command":"GDK_BACKEND=wayland ZENTTY_LINUX_ASYNC_BACKEND=default linux/tests/rust-product-lifecycle"},
    {"id":"release-wayland-epoll-single","order":20,"capability":"terminal_behavior","display":"wayland","optimize":"ReleaseSafe","async_backend":"epoll","terminals":"single","status":"PASS","tier":"local","environment_profile":"nested-wayland-v1","command":"GDK_BACKEND=wayland ZENTTY_LINUX_ASYNC_BACKEND=epoll linux/tests/rust-product-smoke"},
    {"id":"release-wayland-epoll-multi","order":20,"capability":"terminal_behavior","display":"wayland","optimize":"ReleaseSafe","async_backend":"epoll","terminals":"multi","status":"PASS","tier":"local","environment_profile":"nested-wayland-v1","command":"GDK_BACKEND=wayland ZENTTY_LINUX_ASYNC_BACKEND=epoll linux/tests/rust-product-lifecycle"},
    {"id":"release-wayland-io-uring-single","order":20,"capability":"terminal_behavior","display":"wayland","optimize":"ReleaseSafe","async_backend":"io_uring","terminals":"single","status":"PASS","tier":"local","environment_profile":"nested-wayland-v1","command":"GDK_BACKEND=wayland ZENTTY_LINUX_ASYNC_BACKEND=io_uring linux/tests/rust-product-smoke"},
    {"id":"release-wayland-io-uring-multi","order":20,"capability":"terminal_behavior","display":"wayland","optimize":"ReleaseSafe","async_backend":"io_uring","terminals":"multi","status":"PASS","tier":"local","environment_profile":"nested-wayland-v1","command":"GDK_BACKEND=wayland ZENTTY_LINUX_ASYNC_BACKEND=io_uring linux/tests/rust-product-lifecycle"},
    {"id":"release-x11-default-single","order":20,"capability":"terminal_behavior","display":"x11","optimize":"ReleaseSafe","async_backend":"default","terminals":"single","status":"PASS","tier":"local","environment_profile":"nested-x11-v1","command":"GDK_BACKEND=x11 ZENTTY_LINUX_ASYNC_BACKEND=default linux/tests/rust-product-smoke"},
    {"id":"release-x11-default-multi","order":20,"capability":"terminal_behavior","display":"x11","optimize":"ReleaseSafe","async_backend":"default","terminals":"multi","status":"PASS","tier":"local","environment_profile":"nested-x11-v1","command":"GDK_BACKEND=x11 ZENTTY_LINUX_ASYNC_BACKEND=default linux/tests/rust-product-lifecycle"},
    {"id":"release-x11-epoll-single","order":20,"capability":"terminal_behavior","display":"x11","optimize":"ReleaseSafe","async_backend":"epoll","terminals":"single","status":"PASS","tier":"local","environment_profile":"nested-x11-v1","command":"GDK_BACKEND=x11 ZENTTY_LINUX_ASYNC_BACKEND=epoll linux/tests/rust-product-smoke"},
    {"id":"release-x11-epoll-multi","order":20,"capability":"terminal_behavior","display":"x11","optimize":"ReleaseSafe","async_backend":"epoll","terminals":"multi","status":"PASS","tier":"local","environment_profile":"nested-x11-v1","command":"GDK_BACKEND=x11 ZENTTY_LINUX_ASYNC_BACKEND=epoll linux/tests/rust-product-lifecycle"},
    {"id":"release-x11-io-uring-single","order":20,"capability":"terminal_behavior","display":"x11","optimize":"ReleaseSafe","async_backend":"io_uring","terminals":"single","status":"PASS","tier":"local","environment_profile":"nested-x11-v1","command":"GDK_BACKEND=x11 ZENTTY_LINUX_ASYNC_BACKEND=io_uring linux/tests/rust-product-smoke"},
    {"id":"release-x11-io-uring-multi","order":20,"capability":"terminal_behavior","display":"x11","optimize":"ReleaseSafe","async_backend":"io_uring","terminals":"multi","status":"PASS","tier":"local","environment_profile":"nested-x11-v1","command":"GDK_BACKEND=x11 ZENTTY_LINUX_ASYNC_BACKEND=io_uring linux/tests/rust-product-lifecycle"},

    {"id":"release-api-wayland-default","order":22,"capability":"api_misuse","display":"wayland","optimize":"ReleaseSafe","async_backend":"default","terminals":"n/a","status":"PASS","tier":"local","environment_profile":"nested-wayland-v1","command":"GDK_BACKEND=wayland ZENTTY_API_CONTRACT_ASYNC_BACKEND=default build/linux/bin/api-contract | grep -Fx 'api-contract: PASS'"},
    {"id":"release-api-wayland-epoll","order":22,"capability":"api_misuse","display":"wayland","optimize":"ReleaseSafe","async_backend":"epoll","terminals":"n/a","status":"PASS","tier":"local","environment_profile":"nested-wayland-v1","command":"GDK_BACKEND=wayland ZENTTY_API_CONTRACT_ASYNC_BACKEND=epoll build/linux/bin/api-contract | grep -Fx 'api-contract: PASS'"},